[
  {
    "aggregation": "ESTIMATE",
    "allowed_natures": [
      "PROVIDER_ESTIMATE"
    ],
    "description": "Estimated visits",
    "dimensions_schema": {
      "additionalProperties": false,
      "properties": {
        "country": {
          "minLength": 1,
          "type": "string"
        },
        "device": {
          "enum": [
            "DESKTOP",
            "MOBILE_WEB",
            "ALL"
          ]
        },
        "granularity": {
          "enum": [
            "DAILY",
            "WEEKLY",
            "MONTHLY"
          ]
        }
      },
      "required": [
        "country",
        "device",
        "granularity"
      ],
      "type": "object"
    },
    "metric_id": "traffic.visits",
    "requires_denominator": false,
    "section_ids": [
      7
    ],
    "subject_kinds": [
      "ORG",
      "LOCATION",
      "WEBSITE"
    ],
    "unit": "count",
    "value_schema": {
      "minimum": 0,
      "type": "integer"
    }
  },
  {
    "aggregation": "ESTIMATE",
    "allowed_natures": [
      "PROVIDER_ESTIMATE"
    ],
    "description": "Estimated unique visitors",
    "dimensions_schema": {
      "additionalProperties": false,
      "properties": {
        "country": {
          "minLength": 1,
          "type": "string"
        },
        "device": {
          "enum": [
            "DESKTOP",
            "MOBILE_WEB",
            "ALL"
          ]
        },
        "granularity": {
          "enum": [
            "DAILY",
            "WEEKLY",
            "MONTHLY"
          ]
        }
      },
      "required": [
        "country",
        "device",
        "granularity"
      ],
      "type": "object"
    },
    "metric_id": "traffic.unique_visitors",
    "requires_denominator": false,
    "section_ids": [
      7
    ],
    "subject_kinds": [
      "ORG",
      "LOCATION",
      "WEBSITE"
    ],
    "unit": "count",
    "value_schema": {
      "minimum": 0,
      "type": "integer"
    }
  },
  {
    "aggregation": "ESTIMATE",
    "allowed_natures": [
      "PROVIDER_ESTIMATE"
    ],
    "description": "Estimated pageviews",
    "dimensions_schema": {
      "additionalProperties": false,
      "properties": {
        "country": {
          "minLength": 1,
          "type": "string"
        },
        "device": {
          "enum": [
            "DESKTOP",
            "MOBILE_WEB",
            "ALL"
          ]
        },
        "granularity": {
          "enum": [
            "DAILY",
            "WEEKLY",
            "MONTHLY"
          ]
        }
      },
      "required": [
        "country",
        "device",
        "granularity"
      ],
      "type": "object"
    },
    "metric_id": "traffic.pageviews",
    "requires_denominator": false,
    "section_ids": [
      7
    ],
    "subject_kinds": [
      "ORG",
      "LOCATION",
      "WEBSITE"
    ],
    "unit": "count",
    "value_schema": {
      "minimum": 0,
      "type": "integer"
    }
  },
  {
    "aggregation": "ESTIMATE",
    "allowed_natures": [
      "PROVIDER_ESTIMATE"
    ],
    "description": "Estimated pages per visit",
    "dimensions_schema": {
      "additionalProperties": false,
      "properties": {
        "country": {
          "minLength": 1,
          "type": "string"
        },
        "device": {
          "enum": [
            "DESKTOP",
            "MOBILE_WEB",
            "ALL"
          ]
        },
        "granularity": {
          "enum": [
            "DAILY",
            "WEEKLY",
            "MONTHLY"
          ]
        }
      },
      "required": [
        "country",
        "device",
        "granularity"
      ],
      "type": "object"
    },
    "metric_id": "traffic.pages_per_visit",
    "requires_denominator": false,
    "section_ids": [
      7
    ],
    "subject_kinds": [
      "ORG",
      "LOCATION",
      "WEBSITE"
    ],
    "unit": "pages_per_visit",
    "value_schema": {
      "minimum": 0,
      "type": "number"
    }
  },
  {
    "aggregation": "ESTIMATE",
    "allowed_natures": [
      "PROVIDER_ESTIMATE"
    ],
    "description": "Estimated visit duration",
    "dimensions_schema": {
      "additionalProperties": false,
      "properties": {
        "country": {
          "minLength": 1,
          "type": "string"
        },
        "device": {
          "enum": [
            "DESKTOP",
            "MOBILE_WEB",
            "ALL"
          ]
        },
        "granularity": {
          "enum": [
            "DAILY",
            "WEEKLY",
            "MONTHLY"
          ]
        }
      },
      "required": [
        "country",
        "device",
        "granularity"
      ],
      "type": "object"
    },
    "metric_id": "traffic.visit_duration",
    "requires_denominator": false,
    "section_ids": [
      7
    ],
    "subject_kinds": [
      "ORG",
      "LOCATION",
      "WEBSITE"
    ],
    "unit": "seconds",
    "value_schema": {
      "minimum": 0,
      "type": "number"
    }
  },
  {
    "aggregation": "ESTIMATE",
    "allowed_natures": [
      "PROVIDER_ESTIMATE"
    ],
    "description": "Estimated bounce proportion",
    "dimensions_schema": {
      "additionalProperties": false,
      "properties": {
        "country": {
          "minLength": 1,
          "type": "string"
        },
        "device": {
          "enum": [
            "DESKTOP",
            "MOBILE_WEB",
            "ALL"
          ]
        },
        "granularity": {
          "enum": [
            "DAILY",
            "WEEKLY",
            "MONTHLY"
          ]
        }
      },
      "required": [
        "country",
        "device",
        "granularity"
      ],
      "type": "object"
    },
    "metric_id": "traffic.bounce_rate",
    "requires_denominator": false,
    "section_ids": [
      7
    ],
    "subject_kinds": [
      "ORG",
      "LOCATION",
      "WEBSITE"
    ],
    "unit": "proportion",
    "value_schema": {
      "maximum": 1,
      "minimum": 0,
      "type": "number"
    }
  },
  {
    "aggregation": "ESTIMATE",
    "allowed_natures": [
      "PROVIDER_ESTIMATE"
    ],
    "description": "Estimated growth across comparable periods",
    "dimensions_schema": {
      "additionalProperties": false,
      "properties": {
        "country": {
          "minLength": 1,
          "type": "string"
        },
        "device": {
          "enum": [
            "DESKTOP",
            "MOBILE_WEB",
            "ALL"
          ]
        },
        "granularity": {
          "enum": [
            "DAILY",
            "WEEKLY",
            "MONTHLY"
          ]
        }
      },
      "required": [
        "country",
        "device",
        "granularity"
      ],
      "type": "object"
    },
    "metric_id": "traffic.growth",
    "requires_denominator": false,
    "section_ids": [
      7
    ],
    "subject_kinds": [
      "ORG",
      "LOCATION",
      "WEBSITE"
    ],
    "unit": "proportion_change",
    "value_schema": {
      "minimum": -1,
      "type": "number"
    }
  },
  {
    "aggregation": "RANK",
    "allowed_natures": [
      "PROVIDER_ESTIMATE"
    ],
    "description": "Estimated worldwide rank",
    "dimensions_schema": {
      "additionalProperties": false,
      "properties": {
        "country": {
          "minLength": 1,
          "type": "string"
        },
        "device": {
          "enum": [
            "DESKTOP",
            "MOBILE_WEB",
            "ALL"
          ]
        },
        "granularity": {
          "enum": [
            "DAILY",
            "WEEKLY",
            "MONTHLY"
          ]
        }
      },
      "required": [
        "country",
        "device",
        "granularity"
      ],
      "type": "object"
    },
    "metric_id": "traffic.global_rank",
    "requires_denominator": false,
    "section_ids": [
      7
    ],
    "subject_kinds": [
      "ORG",
      "LOCATION",
      "WEBSITE"
    ],
    "unit": "rank",
    "value_schema": {
      "minimum": 1,
      "type": "integer"
    }
  },
  {
    "aggregation": "RANK",
    "allowed_natures": [
      "PROVIDER_ESTIMATE"
    ],
    "description": "Estimated country rank",
    "dimensions_schema": {
      "additionalProperties": false,
      "properties": {
        "country": {
          "minLength": 1,
          "type": "string"
        },
        "device": {
          "enum": [
            "DESKTOP",
            "MOBILE_WEB",
            "ALL"
          ]
        },
        "granularity": {
          "enum": [
            "DAILY",
            "WEEKLY",
            "MONTHLY"
          ]
        }
      },
      "required": [
        "country",
        "device",
        "granularity"
      ],
      "type": "object"
    },
    "metric_id": "traffic.country_rank",
    "requires_denominator": false,
    "section_ids": [
      7
    ],
    "subject_kinds": [
      "ORG",
      "LOCATION",
      "WEBSITE"
    ],
    "unit": "rank",
    "value_schema": {
      "minimum": 1,
      "type": "integer"
    }
  },
  {
    "aggregation": "RANK",
    "allowed_natures": [
      "PROVIDER_ESTIMATE"
    ],
    "description": "Estimated category rank",
    "dimensions_schema": {
      "additionalProperties": false,
      "properties": {
        "country": {
          "minLength": 1,
          "type": "string"
        },
        "device": {
          "enum": [
            "DESKTOP",
            "MOBILE_WEB",
            "ALL"
          ]
        },
        "granularity": {
          "enum": [
            "DAILY",
            "WEEKLY",
            "MONTHLY"
          ]
        }
      },
      "required": [
        "country",
        "device",
        "granularity"
      ],
      "type": "object"
    },
    "metric_id": "traffic.category_rank",
    "requires_denominator": false,
    "section_ids": [
      7
    ],
    "subject_kinds": [
      "ORG",
      "LOCATION",
      "WEBSITE"
    ],
    "unit": "rank",
    "value_schema": {
      "minimum": 1,
      "type": "integer"
    }
  },
  {
    "aggregation": "ESTIMATE",
    "allowed_natures": [
      "PROVIDER_ESTIMATE"
    ],